{
  "$schema": "http://json-schema.org/draft-07/schema#",
  "title": "Create User Response Schema",
  "type": "object",
  "properties": {
    "name": {
      "type": "string"
    },
    "job": {
      "type": "string"
    },
    "id": {
      "type": "string"
    },
    "createdAt": {
      "type": "string",
      "format": "date-time"
    },
    "_meta": {
      "type": "object",
      "properties": {
        "powered_by": {
          "type": "string"
        },
        "docs_url": {
          "type": "string",
          "format": "uri"
        },
        "upgrade_url": {
          "type": "string",
          "format": "uri"
        },
        "example_url": {
          "type": "string",
          "format": "uri"
        },
        "variant": {
          "type": "string"
        },
        "message": {
          "type": "string"
        },
        "cta": {
          "type": "object",
          "properties": {
            "label": {
              "type": "string"
            },
            "url": {
              "type": "string",
              "format": "uri"
            }
          },
          "required": [
            "label",
            "url"
          ],
          "additionalProperties": false
        },
        "context": {
          "type": "string"
        }
      },
      "required": [
        "powered_by",
        "docs_url",
        "upgrade_url",
        "example_url",
        "variant",
        "message",
        "cta",
        "context"
      ],
      "additionalProperties": false
    }
  },
  "required": [
    "name",
    "job",
    "id",
    "createdAt",
    "_meta"
  ],
  "additionalProperties": false
}