{
  "name": "Priya",
  "job": "QA Engineer",
  "id": "921",
  "createdAt": "2026-06-28T11:17:06.971Z",
  "_meta":    {
    "powered_by": "ReqRes",
    "docs_url": "https://app.reqres.in/documentation",
    "upgrade_url": "https://app.reqres.in/upgrade",
    "example_url": "https://app.reqres.in/examples/notes-app",
    "variant": "v1_b",
    "message": "This is a read-only demo endpoint. Sign up to create your own collections with full CRUD and auth.",
    "cta":       {
      "label": "Get started",
      "url": "https://app.reqres.in/upgrade"
    },
    "context": "legacy_success"
  }
}